{
  "claim_registry_file": "claim_registry.json",
  "claim_registry_id": "SCR_05f8c8259dd714cb8db5c63ce0ea43092077d33702293e17ebd1faff1e9b6b01",
  "contract_version": "section-preparation-v1",
  "evidence_counts": {
    "PARTIAL": 3,
    "SUPPORTED": 0,
    "UNSUPPORTED": 47
  },
  "identity": {
    "canonical_corpus_digest": "1fec0054249e8350c1ff300d5669a1ad914b1cd1ec48f3d85b1cc6e22da60660",
    "embedding_model_id": "text-embedding-baai-bge-m3-568m",
    "llm_model_id": "qwen/qwen3.8-27b",
    "model_configuration": "8de0a2f2f275368f3b75a41e64d5a6d2cbdbb54e93bea66e43c0300ad5a350e8",
    "prewriting_audit_id": "PEA_2f345af44628523a55abf2ac91f7385b1b819ffc21d7fbb7440565ca040584c9",
    "prewriting_results_sha256": "7211b1115535f4f968f64cfbb5481229dabcfbc10403002d42f75c64f51f556a",
    "question_bank_sha256": "528baf6e15202c287b7dd3716ce8746fc428fdac1fce10908f61c48cca59ae70",
    "retrieval_index_id": "BRI_283dad3544bd03b43c67e7c252464374e62762add63eadc7b9b10371238fe691",
    "scope_sha256": "54e7a3eb6aa42d613f037e949efba2ad65887608a8c04e0851c756206c331b8a",
    "software_version": "section-preparation-v1"
  },
  "packet_id": "SEP_08e1553acd373f31789340c29e5acdee2bf94bf650451d7dfd694475d770d431",
  "question_count": 50,
  "questions": [
    {
      "allowed_claim_ids": [
        "CLM_98d6ec9b31cc3ac751fe6dcbe16eef345d1c7635738610be092d45c64079a0c1",
        "CLM_9a0b8b165d27e1566e2e035893e18baeac1e541809f0dbc48cfd4c950a7f2e80"
      ],
      "confidence": 0.45,
      "drafting_permission": "LIMITED_WITH_QUALIFIER",
      "evidence_status": "PARTIAL",
      "question": "Ulusal ve Uluslararası Literatür Taraması (Mehmet Çelikkaya) için literatür taramasının temel amacı nedir?",
      "question_id": "6.2-Q01",
      "reason_code": "PARTIAL_ONLY"
    },
    {
      "allowed_claim_ids": [],
      "confidence": 0.1,
      "drafting_permission": "NO_FACTUAL_ANSWER",
      "evidence_status": "UNSUPPORTED",
      "question": "Ulusal ve Uluslararası Literatür Taraması (Mehmet Çelikkaya) hangi araştırma sorularını desteklemek üzere yapılmıştır?",
      "question_id": "6.2-Q02",
      "reason_code": "NO_DIRECT_SUPPORT"
    },
    {
      "allowed_claim_ids": [],
      "confidence": 0.1,
      "drafting_permission": "NO_FACTUAL_ANSWER",
      "evidence_status": "UNSUPPORTED",
      "question": "Ulusal ve Uluslararası Literatür Taraması (Mehmet Çelikkaya) için hangi veri tabanları ve yayın platformları taranmalıdır?",
      "question_id": "6.2-Q03",
      "reason_code": "NO_DIRECT_SUPPORT"
    },
    {
      "allowed_claim_ids": [],
      "confidence": 0.1,
      "drafting_permission": "NO_FACTUAL_ANSWER",
      "evidence_status": "UNSUPPORTED",
      "question": "Ulusal ve Uluslararası Literatür Taraması (Mehmet Çelikkaya) için hangi Türkçe anahtar kelimeler kullanılmalıdır?",
      "question_id": "6.2-Q04",
      "reason_code": "NO_DIRECT_SUPPORT"
    },
    {
      "allowed_claim_ids": [],
      "confidence": 0.1,
      "drafting_permission": "NO_FACTUAL_ANSWER",
      "evidence_status": "UNSUPPORTED",
      "question": "Ulusal ve Uluslararası Literatür Taraması (Mehmet Çelikkaya) için hangi İngilizce anahtar kelimeler kullanılmalıdır?",
      "question_id": "6.2-Q05",
      "reason_code": "NO_DIRECT_SUPPORT"
    },
    {
      "allowed_claim_ids": [],
      "confidence": 0.1,
      "drafting_permission": "NO_FACTUAL_ANSWER",
      "evidence_status": "UNSUPPORTED",
      "question": "Ulusal ve Uluslararası Literatür Taraması (Mehmet Çelikkaya) için arama dizgileri ve Boolean operatörleri nasıl kurulmalıdır?",
      "question_id": "6.2-Q06",
      "reason_code": "NO_DIRECT_SUPPORT"
    },
    {
      "allowed_claim_ids": [],
      "confidence": 0.1,
      "drafting_permission": "NO_FACTUAL_ANSWER",
      "evidence_status": "UNSUPPORTED",
      "question": "Ulusal ve Uluslararası Literatür Taraması (Mehmet Çelikkaya) için taramanın başlangıç ve bitiş tarihleri nasıl belirlenmelidir?",
      "question_id": "6.2-Q07",
      "reason_code": "NO_DIRECT_SUPPORT"
    },
    {
      "allowed_claim_ids": [],
      "confidence": 0.1,
      "drafting_permission": "NO_FACTUAL_ANSWER",
      "evidence_status": "UNSUPPORTED",
      "question": "Ulusal ve Uluslararası Literatür Taraması (Mehmet Çelikkaya) için hangi yayın türleri dahil edilmelidir?",
      "question_id": "6.2-Q08",
      "reason_code": "NO_DIRECT_SUPPORT"
    },
    {
      "allowed_claim_ids": [],
      "confidence": 0.1,
      "drafting_permission": "NO_FACTUAL_ANSWER",
      "evidence_status": "UNSUPPORTED",
      "question": "Ulusal ve Uluslararası Literatür Taraması (Mehmet Çelikkaya) için hangi yayın türleri hariç tutulmalıdır?",
      "question_id": "6.2-Q09",
      "reason_code": "NO_DIRECT_SUPPORT"
    },
    {
      "allowed_claim_ids": [],
      "confidence": 0.1,
      "drafting_permission": "NO_FACTUAL_ANSWER",
      "evidence_status": "UNSUPPORTED",
      "question": "Ulusal ve Uluslararası Literatür Taraması (Mehmet Çelikkaya) için tezler ve akademik makaleler nasıl birlikte değerlendirilmelidir?",
      "question_id": "6.2-Q10",
      "reason_code": "NO_DIRECT_SUPPORT"
    },
    {
      "allowed_claim_ids": [],
      "confidence": 0.1,
      "drafting_permission": "NO_FACTUAL_ANSWER",
      "evidence_status": "UNSUPPORTED",
      "question": "Ulusal ve Uluslararası Literatür Taraması (Mehmet Çelikkaya) için kamu kurumlarının raporları ve teknik şartnameleri nasıl değerlendirilmelidir?",
      "question_id": "6.2-Q11",
      "reason_code": "NO_DIRECT_SUPPORT"
    },
    {
      "allowed_claim_ids": [],
      "confidence": 0.1,
      "drafting_permission": "NO_FACTUAL_ANSWER",
      "evidence_status": "UNSUPPORTED",
      "question": "Ulusal ve Uluslararası Literatür Taraması (Mehmet Çelikkaya) için konferans bildirileri ve sektör raporları nasıl değerlendirilmelidir?",
      "question_id": "6.2-Q12",
      "reason_code": "NO_DIRECT_SUPPORT"
    },
    {
      "allowed_claim_ids": [],
      "confidence": 0.1,
      "drafting_permission": "NO_FACTUAL_ANSWER",
      "evidence_status": "UNSUPPORTED",
      "question": "Ulusal ve Uluslararası Literatür Taraması (Mehmet Çelikkaya) için dahil etme kriterleri nelerdir?",
      "question_id": "6.2-Q13",
      "reason_code": "NO_DIRECT_SUPPORT"
    },
    {
      "allowed_claim_ids": [],
      "confidence": 0.1,
      "drafting_permission": "NO_FACTUAL_ANSWER",
      "evidence_status": "UNSUPPORTED",
      "question": "Ulusal ve Uluslararası Literatür Taraması (Mehmet Çelikkaya) için dışlama kriterleri nelerdir?",
      "question_id": "6.2-Q14",
      "reason_code": "NO_DIRECT_SUPPORT"
    },
    {
      "allowed_claim_ids": [],
      "confidence": 0.1,
      "drafting_permission": "NO_FACTUAL_ANSWER",
      "evidence_status": "UNSUPPORTED",
      "question": "Ulusal ve Uluslararası Literatür Taraması (Mehmet Çelikkaya) için mükerrer yayınlar nasıl ayıklanmalıdır?",
      "question_id": "6.2-Q15",
      "reason_code": "NO_DIRECT_SUPPORT"
    },
    {
      "allowed_claim_ids": [],
      "confidence": 0.1,
      "drafting_permission": "NO_FACTUAL_ANSWER",
      "evidence_status": "UNSUPPORTED",
      "question": "Ulusal ve Uluslararası Literatür Taraması (Mehmet Çelikkaya) için çalışmaların kalite değerlendirmesi nasıl yapılmalıdır?",
      "question_id": "6.2-Q16",
      "reason_code": "NO_DIRECT_SUPPORT"
    },
    {
      "allowed_claim_ids": [],
      "confidence": 0.1,
      "drafting_permission": "NO_FACTUAL_ANSWER",
      "evidence_status": "UNSUPPORTED",
      "question": "Ulusal ve Uluslararası Literatür Taraması (Mehmet Çelikkaya) için çalışmaların kanıt düzeyi nasıl sınıflandırılabilir?",
      "question_id": "6.2-Q17",
      "reason_code": "NO_DIRECT_SUPPORT"
    },
    {
      "allowed_claim_ids": [],
      "confidence": 0.1,
      "drafting_permission": "NO_FACTUAL_ANSWER",
      "evidence_status": "UNSUPPORTED",
      "question": "Ulusal ve Uluslararası Literatür Taraması (Mehmet Çelikkaya) içinde hangi ülkeler veya bölgeler daha fazla temsil edilmektedir?",
      "question_id": "6.2-Q18",
      "reason_code": "NO_DIRECT_SUPPORT"
    },
    {
      "allowed_claim_ids": [],
      "confidence": 0.1,
      "drafting_permission": "NO_FACTUAL_ANSWER",
      "evidence_status": "UNSUPPORTED",
      "question": "Ulusal ve Uluslararası Literatür Taraması (Mehmet Çelikkaya) içinde Türkiye’ye özgü çalışmaların sayısı ve niteliği nedir?",
      "question_id": "6.2-Q19",
      "reason_code": "NO_DIRECT_SUPPORT"
    },
    {
      "allowed_claim_ids": [],
      "confidence": 0.1,
      "drafting_permission": "NO_FACTUAL_ANSWER",
      "evidence_status": "UNSUPPORTED",
      "question": "Ulusal ve Uluslararası Literatür Taraması (Mehmet Çelikkaya) içinde karayolu tünellerine odaklanan çalışmalar nasıl ayrıştırılmalıdır?",
      "question_id": "6.2-Q20",
      "reason_code": "NO_DIRECT_SUPPORT"
    },
    {
      "allowed_claim_ids": [
        "CLM_98d6ec9b31cc3ac751fe6dcbe16eef345d1c7635738610be092d45c64079a0c1",
        "CLM_9a0b8b165d27e1566e2e035893e18baeac1e541809f0dbc48cfd4c950a7f2e80"
      ],
      "confidence": 0.4,
      "drafting_permission": "LIMITED_WITH_QUALIFIER",
      "evidence_status": "PARTIAL",
      "question": "Ulusal ve Uluslararası Literatür Taraması (Mehmet Çelikkaya) içinde yapım maliyetine odaklanan çalışmalar nasıl ayrıştırılmalıdır?",
      "question_id": "6.2-Q21",
      "reason_code": "PARTIAL_ONLY"
    },
    {
      "allowed_claim_ids": [],
      "confidence": 0.1,
      "drafting_permission": "NO_FACTUAL_ANSWER",
      "evidence_status": "UNSUPPORTED",
      "question": "Ulusal ve Uluslararası Literatür Taraması (Mehmet Çelikkaya) içinde bakım ve işletme maliyetine odaklanan çalışmalar nasıl ayrıştırılmalıdır?",
      "question_id": "6.2-Q22",
      "reason_code": "NO_DIRECT_SUPPORT"
    },
    {
      "allowed_claim_ids": [],
      "confidence": 0.1,
      "drafting_permission": "NO_FACTUAL_ANSWER",
      "evidence_status": "UNSUPPORTED",